{"schema_id":"urn:au-ucr:schema:governed-audit-event:1.0.0","schema_version":"1.0.0","event_id":"urn:uuid:22222222-2222-4222-8222-222222222222","actor_id":"urn:example:actor:synthetic","interface_id":"IF-15","interface_inventory_id":"urn:example:interface:synthetic","object_id":"urn:example:object:synthetic","prior_object_version":0,"new_object_version":1,"requested_transition":"A01:NOT_STARTED->IN_PROGRESS","from_status":"NOT_STARTED","to_status":"IN_PROGRESS","decision":"ALLOW","reason_codes":[],"policy_digest":"aaaaaaaaaaaaaaaaaaaaaaaaaaaaaaaaaaaaaaaaaaaaaaaaaaaaaaaaaaaaaaaa","schema_bundle_digest":"bbbbbbbbbbbbbbbbbbbbbbbbbbbbbbbbbbbbbbbbbbbbbbbbbbbbbbbbbbbbbbbb","algorithm_registry_digest":"cccccccccccccccccccccccccccccccccccccccccccccccccccccccccccccccc","dependency_registry_digest":"dddddddddddddddddddddddddddddddddddddddddddddddddddddddddddddddd","reason_registry_digest":"eeeeeeeeeeeeeeeeeeeeeeeeeeeeeeeeeeeeeeeeeeeeeeeeeeeeeeeeeeeeeeee","evidence_bundle_digest":"ffffffffffffffffffffffffffffffffffffffffffffffffffffffffffffffff","workload_identity":"urn:example:service:gpep-synthetic","transaction_outcome":"COMMITTED","idempotency_key":"synthetic-idempotency-1","correlation_id":"synthetic-correlation-1","trusted_receipt_time":"2026-10-12T10:00:00Z"}
